{
  "assets": [
    {
      "artifact": {
        "byte_length": 44,
        "media_type": "audio/wav",
        "sha256": "aaaaaaaaaaaaaaaaaaaaaaaaaaaaaaaaaaaaaaaaaaaaaaaaaaaaaaaaaaaaaaaa"
      },
      "asset_id": "20000000-0000-4000-8000-000000000001"
    }
  ],
  "banks": [
    {
      "bank": 0,
      "pads": [
        {
          "asset_id": "20000000-0000-4000-8000-000000000001",
          "pad": 0,
          "playback": {
            "gain_millidb": 0,
            "muted": false,
            "trigger_mode": "one_shot",
            "trim_end_frame": null,
            "trim_start_frame": 0
          }
        },
        {
          "asset_id": null,
          "pad": 1,
          "playback": {
            "gain_millidb": 0,
            "muted": false,
            "trigger_mode": "one_shot",
            "trim_end_frame": null,
            "trim_start_frame": 0
          }
        },
        {
          "asset_id": null,
          "pad": 2,
          "playback": {
            "gain_millidb": 0,
            "muted": false,
            "trigger_mode": "one_shot",
            "trim_end_frame": null,
            "trim_start_frame": 0
          }
        },
        {
          "asset_id": null,
          "pad": 3,
          "playback": {
            "gain_millidb": 0,
            "muted": false,
            "trigger_mode": "one_shot",
            "trim_end_frame": null,
            "trim_start_frame": 0
          }
        },
        {
          "asset_id": null,
          "pad": 4,
          "playback": {
            "gain_millidb": 0,
            "muted": false,
            "trigger_mode": "one_shot",
            "trim_end_frame": null,
            "trim_start_frame": 0
          }
        },
        {
          "asset_id": null,
          "pad": 5,
          "playback": {
            "gain_millidb": 0,
            "muted": false,
            "trigger_mode": "one_shot",
            "trim_end_frame": null,
            "trim_start_frame": 0
          }
        },
        {
          "asset_id": null,
          "pad": 6,
          "playback": {
            "gain_millidb": 0,
            "muted": false,
            "trigger_mode": "one_shot",
            "trim_end_frame": null,
            "trim_start_frame": 0
          }
        },
        {
          "asset_id": null,
          "pad": 7,
          "playback": {
            "gain_millidb": 0,
            "muted": false,
            "trigger_mode": "one_shot",
            "trim_end_frame": null,
            "trim_start_frame": 0
          }
        },
        {
          "asset_id": null,
          "pad": 8,
          "playback": {
            "gain_millidb": 0,
            "muted": false,
            "trigger_mode": "one_shot",
            "trim_end_frame": null,
            "trim_start_frame": 0
          }
        },
        {
          "asset_id": null,
          "pad": 9,
          "playback": {
            "gain_millidb": 0,
            "muted": false,
            "trigger_mode": "one_shot",
            "trim_end_frame": null,
            "trim_start_frame": 0
          }
        },
        {
          "asset_id": null,
          "pad": 10,
          "playback": {
            "gain_millidb": 0,
            "muted": false,
            "trigger_mode": "one_shot",
            "trim_end_frame": null,
            "trim_start_frame": 0
          }
        },
        {
          "asset_id": null,
          "pad": 11,
          "playback": {
            "gain_millidb": 0,
            "muted": false,
            "trigger_mode": "one_shot",
            "trim_end_frame": null,
            "trim_start_frame": 0
          }
        },
        {
          "asset_id": null,
          "pad": 12,
          "playback": {
            "gain_millidb": 0,
            "muted": false,
            "trigger_mode": "one_shot",
            "trim_end_frame": null,
            "trim_start_frame": 0
          }
        },
        {
          "asset_id": null,
          "pad": 13,
          "playback": {
            "gain_millidb": 0,
            "muted": false,
            "trigger_mode": "one_shot",
            "trim_end_frame": null,
            "trim_start_frame": 0
          }
        },
        {
          "asset_id": null,
          "pad": 14,
          "playback": {
            "gain_millidb": 0,
            "muted": false,
            "trigger_mode": "one_shot",
            "trim_end_frame": null,
            "trim_start_frame": 0
          }
        },
        {
          "asset_id": null,
          "pad": 15,
          "playback": {
            "gain_millidb": 0,
            "muted": false,
            "trigger_mode": "one_shot",
            "trim_end_frame": null,
            "trim_start_frame": 0
          }
        }
      ]
    },
    {
      "bank": 1,
      "pads": [
        {
          "asset_id": null,
          "pad": 0,
          "playback": {
            "gain_millidb": 0,
            "muted": false,
            "trigger_mode": "one_shot",
            "trim_end_frame": null,
            "trim_start_frame": 0
          }
        },
        {
          "asset_id": null,
          "pad": 1,
          "playback": {
            "gain_millidb": 0,
            "muted": false,
            "trigger_mode": "one_shot",
            "trim_end_frame": null,
            "trim_start_frame": 0
          }
        },
        {
          "asset_id": null,
          "pad": 2,
          "playback": {
            "gain_millidb": 0,
            "muted": false,
            "trigger_mode": "one_shot",
            "trim_end_frame": null,
            "trim_start_frame": 0
          }
        },
        {
          "asset_id": null,
          "pad": 3,
          "playback": {
            "gain_millidb": 0,
            "muted": false,
            "trigger_mode": "one_shot",
            "trim_end_frame": null,
            "trim_start_frame": 0
          }
        },
        {
          "asset_id": null,
          "pad": 4,
          "playback": {
            "gain_millidb": 0,
            "muted": false,
            "trigger_mode": "one_shot",
            "trim_end_frame": null,
            "trim_start_frame": 0
          }
        },
        {
          "asset_id": null,
          "pad": 5,
          "playback": {
            "gain_millidb": 0,
            "muted": false,
            "trigger_mode": "one_shot",
            "trim_end_frame": null,
            "trim_start_frame": 0
          }
        },
        {
          "asset_id": null,
          "pad": 6,
          "playback": {
            "gain_millidb": 0,
            "muted": false,
            "trigger_mode": "one_shot",
            "trim_end_frame": null,
            "trim_start_frame": 0
          }
        },
        {
          "asset_id": null,
          "pad": 7,
          "playback": {
            "gain_millidb": 0,
            "muted": false,
            "trigger_mode": "one_shot",
            "trim_end_frame": null,
            "trim_start_frame": 0
          }
        },
        {
          "asset_id": null,
          "pad": 8,
          "playback": {
            "gain_millidb": 0,
            "muted": false,
            "trigger_mode": "one_shot",
            "trim_end_frame": null,
            "trim_start_frame": 0
          }
        },
        {
          "asset_id": null,
          "pad": 9,
          "playback": {
            "gain_millidb": 0,
            "muted": false,
            "trigger_mode": "one_shot",
            "trim_end_frame": null,
            "trim_start_frame": 0
          }
        },
        {
          "asset_id": null,
          "pad": 10,
          "playback": {
            "gain_millidb": 0,
            "muted": false,
            "trigger_mode": "one_shot",
            "trim_end_frame": null,
            "trim_start_frame": 0
          }
        },
        {
          "asset_id": null,
          "pad": 11,
          "playback": {
            "gain_millidb": 0,
            "muted": false,
            "trigger_mode": "one_shot",
            "trim_end_frame": null,
            "trim_start_frame": 0
          }
        },
        {
          "asset_id": null,
          "pad": 12,
          "playback": {
            "gain_millidb": 0,
            "muted": false,
            "trigger_mode": "one_shot",
            "trim_end_frame": null,
            "trim_start_frame": 0
          }
        },
        {
          "asset_id": null,
          "pad": 13,
          "playback": {
            "gain_millidb": 0,
            "muted": false,
            "trigger_mode": "one_shot",
            "trim_end_frame": null,
            "trim_start_frame": 0
          }
        },
        {
          "asset_id": null,
          "pad": 14,
          "playback": {
            "gain_millidb": 0,
            "muted": false,
            "trigger_mode": "one_shot",
            "trim_end_frame": null,
            "trim_start_frame": 0
          }
        },
        {
          "asset_id": null,
          "pad": 15,
          "playback": {
            "gain_millidb": 0,
            "muted": false,
            "trigger_mode": "one_shot",
            "trim_end_frame": null,
            "trim_start_frame": 0
          }
        }
      ]
    },
    {
      "bank": 2,
      "pads": [
        {
          "asset_id": null,
          "pad": 0,
          "playback": {
            "gain_millidb": 0,
            "muted": false,
            "trigger_mode": "one_shot",
            "trim_end_frame": null,
            "trim_start_frame": 0
          }
        },
        {
          "asset_id": null,
          "pad": 1,
          "playback": {
            "gain_millidb": 0,
            "muted": false,
            "trigger_mode": "one_shot",
            "trim_end_frame": null,
            "trim_start_frame": 0
          }
        },
        {
          "asset_id": null,
          "pad": 2,
          "playback": {
            "gain_millidb": 0,
            "muted": false,
            "trigger_mode": "one_shot",